proposition;categorie;type;contexte;anne_hidalgo;emmanuel_macron;fabien_roussel;jean_lassalle;jeanluc_melenchon;marine_le_pen;nathalie_arthaud;nicolas_dupontaignan;philippe_poutou;valerie_pecresse;yannick_jadot;eric_zemmour
Interdire le port du voile et de la kippa dans l'espace public ;Immigration et Intégration;"Éric 
Zemmour";Une loi de 2010 interdit déjà la dissimulation du visage dans l'espace public. Elle a été adoptée sous le mandat de Nicolas Sarkozy, dans un contexte de débat autour du voile intégral et en particulier du niqab.;Non;Non;Non;Non;Non;Non;Non;Non;Non;Non;Non;Oui
Soumettre par référendum l'inscription dans la Constitution de la « priorité nationale » ;Immigration et Intégration;"Marine 
Le Pen";La « priorité nationale » consisterait par exemple à traiter en priorité les dossiers de personnes de nationalité française dans les demandes d'habitation à loyer modéré (HLM).;Non;Non;Non;Non;Non;Oui;Non;Non;Non;Non;Non;Non
Exonérer d'impôt sur le revenu les jeunes actifs de moins de 30 ans ;Fiscalité;"Marine 
Le Pen";Un Français gagnant moins de 15 547 euros nets par an en 2021 n'est pas concerné par l'impôt sur le revenu en 2022, s'il est seul sur son foyer fiscal.  ;Non;Non;Non;Non;Non;Oui;Non;Non;Non;Non;Non;Non
Inscrire au fichier des délinquants sexuels les harceleurs de rue ;Sécurité et Justice;"Marine 
Le Pen";Le fichier judiciaire des auteurs d'infractions sexuelles et violentes recense actuellement les personnes condamnées notamment pour viol, agression sexuelle et atteinte sexuelle sur mineur. Le fichier permet de faciliter l'identification et la localisation des auteurs de ces infractions.;Non;Non;Non;Non;Non;Oui;Non;Non;Non;Non;Non;Non
Expulser tous les étrangers n'ayant pas travaillé depuis un an en France;Immigration et Intégration;"Marine 
Le Pen";Actuellement, l'expulsion d'un ressortissant étranger est une procédure exceptionnelle, prononcée dans des situations graves, comme l'atteinte à la sûreté de l'État. Pour les étrangers en situation irrégulière, une obligation de quitter le territoire français (OQTF) les contraint à quitter la France dans un délai de 30 jours.;Non;Non;Non;Non;Non;Oui;Non;Non;Non;Non;Non;Non